task_step,task_completion_percentage,previous_actions,choices,correct_choice,correct_action
4,0.8,"['Get dressed in tennis clothes', 'Find tennis racket', 'Find tennis balls', 'Drive to tennis court']","['Get dressed in tennis clothes', 'Play tennis']",Play tennis,1
0,0.0,[],"['Drive to tennis court.', 'Stretch']",Drive to tennis court.,0
1,0.2,['Drive to tennis court.'],"['Exit car.', 'Stretch']",Exit car.,0
2,0.4,"['Drive to tennis court.', 'Exit car.']","['Take rackets and balls.', 'Stretch']",Take rackets and balls.,0
3,0.6,"['Drive to tennis court.', 'Exit car.', 'Take rackets and balls.']","['Find empty court.', 'Drive to tennis court.']",Find empty court.,0
4,0.8,"['Drive to tennis court.', 'Exit car.', 'Take rackets and balls.', 'Find empty court.']","['Stretch', 'Drive to tennis court.']",Stretch,0
0,0.0,[],"['wait for player to hit ball back to you', 'hit ball to other player']",hit ball to other player,1
1,0.2,['hit ball to other player'],"['wait for player to hit ball back to you', 'wait for other player to hit ball back']",wait for other player to hit ball back,1
2,0.4,"['hit ball to other player', 'wait for other player to hit ball back']","['hit ball to other player', 'miss ball and cry']",hit ball to other player,0
3,0.6,"['hit ball to other player', 'wait for other player to hit ball back', 'hit ball to other player']","['wait for player to hit ball back to you', 'hit ball to other player']",wait for player to hit ball back to you,0
4,0.8,"['hit ball to other player', 'wait for other player to hit ball back', 'hit ball to other player', 'wait for player to hit ball back to you']","['miss ball and cry', 'hit ball to other player']",miss ball and cry,0
0,0.0,[],"['Get appropriate attire', 'Get tennis racket']",Get appropriate attire,0
1,0.2,['Get appropriate attire'],"['Get tennis racket', 'Get appropriate attire']",Get tennis racket,0
2,0.4,"['Get appropriate attire', 'Get tennis racket']","['Go to tennis court', 'Play tennis']",Go to tennis court,0
3,0.6,"['Get appropriate attire', 'Get tennis racket', 'Go to tennis court']","['Stretch and warm up', 'Get appropriate attire']",Stretch and warm up,0
4,0.8,"['Get appropriate attire', 'Get tennis racket', 'Go to tennis court', 'Stretch and warm up']","['Get tennis racket', 'Play tennis']",Play tennis,1
0,0.0,[],"['Wait for opponent to hit ball back', 'Pick up ball']",Pick up ball,1
1,0.2,['Pick up ball'],"['Pick up racket', 'Pick up racket']",Pick up racket,0
2,0.4,"['Pick up ball', 'Pick up racket']","['Hit ball back to opponent', 'Toss ball into air and hit it with racket over net']",Toss ball into air and hit it with racket over net,1
3,0.6,"['Pick up ball', 'Pick up racket', 'Toss ball into air and hit it with racket over net']","['Wait for opponent to hit ball back', 'Pick up ball']",Wait for opponent to hit ball back,0
4,0.8,"['Pick up ball', 'Pick up racket', 'Toss ball into air and hit it with racket over net', 'Wait for opponent to hit ball back']","['Hit ball back to opponent', 'Pick up ball']",Hit ball back to opponent,0
0,0.0,[],"['going to the court', 'going to the court']",going to the court,0
1,0.2,['going to the court'],"['swinging the racket', 'serving the ball']",serving the ball,1
2,0.4,"['going to the court', 'serving the ball']","['hitting the ball with the racket', 'hitting the ball over the net']",hitting the ball with the racket,0
3,0.6,"['going to the court', 'serving the ball', 'hitting the ball with the racket']","['going to the court', 'swinging the racket']",swinging the racket,1
4,0.8,"['going to the court', 'serving the ball', 'hitting the ball with the racket', 'swinging the racket']","['hitting the ball over the net', 'serving the ball']",hitting the ball over the net,0
0,0.0,[],"['practice volleys', 'arrive at tennis courts']",arrive at tennis courts,1
1,0.2,['arrive at tennis courts'],"['arrive at tennis courts', 'stretch muscles and limbs']",stretch muscles and limbs,1
2,0.4,"['arrive at tennis courts', 'stretch muscles and limbs']","['start match with first serve', 'practice serving']",practice serving,1
3,0.6,"['arrive at tennis courts', 'stretch muscles and limbs', 'practice serving']","['practice volleys', 'arrive at tennis courts']",practice volleys,0
4,0.8,"['arrive at tennis courts', 'stretch muscles and limbs', 'practice serving', 'practice volleys']","['start match with first serve', 'stretch muscles and limbs']",start match with first serve,0
0,0.0,[],"['Find a person to play with.', 'Server ball over net.']",Find a person to play with.,0
1,0.2,['Find a person to play with.'],"['Drive to tennis court.', 'Hit tennis ball again over net.']",Drive to tennis court.,0
2,0.4,"['Find a person to play with.', 'Drive to tennis court.']","['Server ball over net.', 'Hit tennis ball again over net.']",Server ball over net.,0
3,0.6,"['Find a person to play with.', 'Drive to tennis court.', 'Server ball over net.']","['Wait for person to return ball.', 'Find a person to play with.']",Wait for person to return ball.,0
4,0.8,"['Find a person to play with.', 'Drive to tennis court.', 'Server ball over net.', 'Wait for person to return ball.']","['Find a person to play with.', 'Hit tennis ball again over net.']",Hit tennis ball again over net.,1
0,0.0,[],"['go to courts', 'go to courts']",go to courts,0
1,0.2,['go to courts'],"['stretch', 'stretch']",stretch,1
2,0.4,"['go to courts', 'stretch']","['jump over net', 'warm up']",warm up,1
3,0.6,"['go to courts', 'stretch', 'warm up']","['defeat opponent by any means necessary', 'go to courts']",defeat opponent by any means necessary,0
4,0.8,"['go to courts', 'stretch', 'warm up', 'defeat opponent by any means necessary']","['stretch', 'jump over net']",jump over net,1
0,0.0,[],"['Drive to the tennis court', 'Gather tennis racket and balls']",Gather tennis racket and balls,1
1,0.2,['Gather tennis racket and balls'],"['Walk over to the court', 'Get into your car with items']",Get into your car with items,1
2,0.4,"['Gather tennis racket and balls', 'Get into your car with items']","['Drive to the tennis court', 'Walk over to the court']",Drive to the tennis court,0
3,0.6,"['Gather tennis racket and balls', 'Get into your car with items', 'Drive to the tennis court']","['Get out of car with items', 'Gather tennis racket and balls']",Get out of car with items,0
4,0.8,"['Gather tennis racket and balls', 'Get into your car with items', 'Drive to the tennis court', 'Get out of car with items']","['Gather tennis racket and balls', 'Walk over to the court']",Walk over to the court,1
0,0.0,[],"['Go to the tennis court', 'Go to the tennis court']",Go to the tennis court,0
1,0.2,['Go to the tennis court'],"['Go to the tennis court', 'Hit the ball at the racket']",Hit the ball at the racket,1
2,0.4,"['Go to the tennis court', 'Hit the ball at the racket']","['Wait for opposing player to hit the ball back', 'Continue steps two through four']",Wait for opposing player to hit the ball back,0
3,0.6,"['Go to the tennis court', 'Hit the ball at the racket', 'Wait for opposing player to hit the ball back']","['Go to the tennis court', 'When ball comes back, hit it back to the other player']","When ball comes back, hit it back to the other player",1
4,0.8,"['Go to the tennis court', 'Hit the ball at the racket', 'Wait for opposing player to hit the ball back', 'When ball comes back, hit it back to the other player']","['Continue steps two through four', 'Go to the tennis court']",Continue steps two through four,0
0,0.0,[],"['choose a side to play on, while you opponent takes the other side', 'dress in loose fitting clothing']",dress in loose fitting clothing,1
1,0.2,['dress in loose fitting clothing'],"['gather equipment', 'go to courts']",gather equipment,0
2,0.4,"['dress in loose fitting clothing', 'gather equipment']","['go to courts', 'choose a side to play on, while you opponent takes the other side']",go to courts,0
3,0.6,"['dress in loose fitting clothing', 'gather equipment', 'go to courts']","['open the can of tennis balls', 'dress in loose fitting clothing']",open the can of tennis balls,0
4,0.8,"['dress in loose fitting clothing', 'gather equipment', 'go to courts', 'open the can of tennis balls']","['dress in loose fitting clothing', 'choose a side to play on, while you opponent takes the other side']","choose a side to play on, while you opponent takes the other side",1
0,0.0,[],"['GET TENNIS RACQUET', 'FIND AN OPPONENT']",GET TENNIS RACQUET,0
1,0.2,['GET TENNIS RACQUET'],"['HIT TENNIS BALL BACK AND FORTH OVER THE NET', 'GO TO TENNIS COURT']",GO TO TENNIS COURT,1
2,0.4,"['GET TENNIS RACQUET', 'GO TO TENNIS COURT']","['FIND AN OPPONENT', 'HIT TENNIS BALL BACK AND FORTH OVER THE NET']",FIND AN OPPONENT,0
3,0.6,"['GET TENNIS RACQUET', 'GO TO TENNIS COURT', 'FIND AN OPPONENT']","['GET TENNIS RACQUET', 'PLAY TENNIS WITH OTHER PERSON']",PLAY TENNIS WITH OTHER PERSON,1
4,0.8,"['GET TENNIS RACQUET', 'GO TO TENNIS COURT', 'FIND AN OPPONENT', 'PLAY TENNIS WITH OTHER PERSON']","['HIT TENNIS BALL BACK AND FORTH OVER THE NET', 'GO TO TENNIS COURT']",HIT TENNIS BALL BACK AND FORTH OVER THE NET,0
0,0.0,[],"['find person to play with', 'await for opponent to hit ball back to you']",find person to play with,0
1,0.2,['find person to play with'],"['find person to play with', 'collect tennis racket and tennis balls']",collect tennis racket and tennis balls,1
2,0.4,"['find person to play with', 'collect tennis racket and tennis balls']","['drive to tennis court', 'await for opponent to hit ball back to you']",drive to tennis court,0
3,0.6,"['find person to play with', 'collect tennis racket and tennis balls', 'drive to tennis court']","['hit ball to opponent with tennis racket', 'find person to play with']",hit ball to opponent with tennis racket,0
4,0.8,"['find person to play with', 'collect tennis racket and tennis balls', 'drive to tennis court', 'hit ball to opponent with tennis racket']","['await for opponent to hit ball back to you', 'find person to play with']",await for opponent to hit ball back to you,0
0,0.0,[],"['Dress in your finest athletic gear', 'Dress in your finest athletic gear']",Dress in your finest athletic gear,1
1,0.2,['Dress in your finest athletic gear'],"['Go to the tennis court', 'Hit the tennis balls towards your opponent when they hit them to you']",Go to the tennis court,0
2,0.4,"['Dress in your finest athletic gear', 'Go to the tennis court']","['Throw some balls in the air and hit them with your racket, otherwise known as serving', 'Try to make your opponent miss the tennis ball']","Throw some balls in the air and hit them with your racket, otherwise known as serving",0
3,0.6,"['Dress in your finest athletic gear', 'Go to the tennis court', 'Throw some balls in the air and hit them with your racket, otherwise known as serving']","['Dress in your finest athletic gear', 'Hit the tennis balls towards your opponent when they hit them to you']",Hit the tennis balls towards your opponent when they hit them to you,1
4,0.8,"['Dress in your finest athletic gear', 'Go to the tennis court', 'Throw some balls in the air and hit them with your racket, otherwise known as serving', 'Hit the tennis balls towards your opponent when they hit them to you']","['Try to make your opponent miss the tennis ball', 'Go to the tennis court']",Try to make your opponent miss the tennis ball,0
0,0.0,[],"['Wear appropriate tennis clothing and shoes.', 'Wear appropriate tennis clothing and shoes.']",Wear appropriate tennis clothing and shoes.,1
1,0.2,['Wear appropriate tennis clothing and shoes.'],"['Go to your assigned side of the tennis court.', 'Play the game using a racket.']",Go to your assigned side of the tennis court.,0
2,0.4,"['Wear appropriate tennis clothing and shoes.', 'Go to your assigned side of the tennis court.']","['Keep yourself hydrated by drinking water.', 'Play the game using a racket.']",Play the game using a racket.,1
3,0.6,"['Wear appropriate tennis clothing and shoes.', 'Go to your assigned side of the tennis court.', 'Play the game using a racket.']","['Wear appropriate tennis clothing and shoes.', 'Keep score to see who wins.']",Keep score to see who wins.,1
4,0.8,"['Wear appropriate tennis clothing and shoes.', 'Go to your assigned side of the tennis court.', 'Play the game using a racket.', 'Keep score to see who wins.']","['Keep yourself hydrated by drinking water.', 'Go to your assigned side of the tennis court.']",Keep yourself hydrated by drinking water.,0
0,0.0,[],"['Find someone to play with', 'Find empty tennis court']",Find someone to play with,0
1,0.2,['Find someone to play with'],"['Get tennis racket', 'Get tennis balls']",Get tennis racket,0
2,0.4,"['Find someone to play with', 'Get tennis racket']","['Get tennis balls', 'Stretch and warm up to play']",Get tennis balls,0
3,0.6,"['Find someone to play with', 'Get tennis racket', 'Get tennis balls']","['Find empty tennis court', 'Find someone to play with']",Find empty tennis court,0
4,0.8,"['Find someone to play with', 'Get tennis racket', 'Get tennis balls', 'Find empty tennis court']","['Get tennis racket', 'Stretch and warm up to play']",Stretch and warm up to play,1
0,0.0,[],"['Get tennis partner.', 'Walk onto court.']",Get tennis partner.,0
1,0.2,['Get tennis partner.'],"['Get racket and ball.', 'Get tennis partner.']",Get racket and ball.,0
2,0.4,"['Get tennis partner.', 'Get racket and ball.']","['Serve ball with racket.', 'Walk onto court.']",Walk onto court.,1
3,0.6,"['Get tennis partner.', 'Get racket and ball.', 'Walk onto court.']","['Get tennis partner.', 'Throw ball into air.']",Throw ball into air.,1
4,0.8,"['Get tennis partner.', 'Get racket and ball.', 'Walk onto court.', 'Throw ball into air.']","['Get tennis partner.', 'Serve ball with racket.']",Serve ball with racket.,1
0,0.0,[],"['Serve the ball with your racket', 'Put on appropriate tennis attire']",Put on appropriate tennis attire,1
1,0.2,['Put on appropriate tennis attire'],"['Find a partner or team to play with', 'Put on appropriate tennis attire']",Find a partner or team to play with,0
2,0.4,"['Put on appropriate tennis attire', 'Find a partner or team to play with']","['Prepare for the ball to return to your side of court', 'Decide which side goes first']",Decide which side goes first,1
3,0.6,"['Put on appropriate tennis attire', 'Find a partner or team to play with', 'Decide which side goes first']","['Put on appropriate tennis attire', 'Serve the ball with your racket']",Serve the ball with your racket,1
4,0.8,"['Put on appropriate tennis attire', 'Find a partner or team to play with', 'Decide which side goes first', 'Serve the ball with your racket']","['Prepare for the ball to return to your side of court', 'Find a partner or team to play with']",Prepare for the ball to return to your side of court,0
0,0.0,[],"['Find a tennis partner', 'Find a tennis partner']",Find a tennis partner,1
1,0.2,['Find a tennis partner'],"['Go to tennis court with partner', 'Get a tennis racket']",Get a tennis racket,1
2,0.4,"['Find a tennis partner', 'Get a tennis racket']","['Get tennis balls', 'You and partner each take one side of the court']",Get tennis balls,0
3,0.6,"['Find a tennis partner', 'Get a tennis racket', 'Get tennis balls']","['Find a tennis partner', 'Go to tennis court with partner']",Go to tennis court with partner,1
4,0.8,"['Find a tennis partner', 'Get a tennis racket', 'Get tennis balls', 'Go to tennis court with partner']","['Get a tennis racket', 'You and partner each take one side of the court']",You and partner each take one side of the court,1
0,0.0,[],"['Find an outfit to play in.', 'Walk to the tennis court.']",Find an outfit to play in.,0
1,0.2,['Find an outfit to play in.'],"['Ask a friend to play.', 'Practice my serve.']",Ask a friend to play.,0
2,0.4,"['Find an outfit to play in.', 'Ask a friend to play.']","['Walk to the tennis court.', 'Play tennis.']",Walk to the tennis court.,0
3,0.6,"['Find an outfit to play in.', 'Ask a friend to play.', 'Walk to the tennis court.']","['Practice my serve.', 'Find an outfit to play in.']",Practice my serve.,0
4,0.8,"['Find an outfit to play in.', 'Ask a friend to play.', 'Walk to the tennis court.', 'Practice my serve.']","['Play tennis.', 'Ask a friend to play.']",Play tennis.,0
0,0.0,[],"['toss ball in air in front of you', 'get tennis racket']",get tennis racket,1
1,0.2,['get tennis racket'],"['get tennis racket', 'get tennis ball']",get tennis ball,1
2,0.4,"['get tennis racket', 'get tennis ball']","['step onto the tennis court', 'toss ball in air in front of you']",step onto the tennis court,0
3,0.6,"['get tennis racket', 'get tennis ball', 'step onto the tennis court']","['get tennis racket', 'bounce ball a couple of times']",bounce ball a couple of times,1
4,0.8,"['get tennis racket', 'get tennis ball', 'step onto the tennis court', 'bounce ball a couple of times']","['toss ball in air in front of you', 'get tennis ball']",toss ball in air in front of you,0
0,0.0,[],"['Get a partner', 'Throw ball in air']",Get a partner,0
1,0.2,['Get a partner'],"['Get a racket', 'Get a racket']",Get a racket,1
2,0.4,"['Get a partner', 'Get a racket']","['Get a tennis ball', 'Throw ball in air']",Get a tennis ball,0
3,0.6,"['Get a partner', 'Get a racket', 'Get a tennis ball']","['Get a partner', 'Go to tennis court']",Go to tennis court,1
4,0.8,"['Get a partner', 'Get a racket', 'Get a tennis ball', 'Go to tennis court']","['Get a racket', 'Throw ball in air']",Throw ball in air,1
0,0.0,[],"['Walk on tennis court.', 'Grab a racket.']",Walk on tennis court.,0
1,0.2,['Walk on tennis court.'],"['Get a ball.', 'Walk on tennis court.']",Get a ball.,0
2,0.4,"['Walk on tennis court.', 'Get a ball.']","['Throw ball in air.', 'Grab a racket.']",Grab a racket.,1
3,0.6,"['Walk on tennis court.', 'Get a ball.', 'Grab a racket.']","['Walk on tennis court.', 'Stand behind line.']",Stand behind line.,1
4,0.8,"['Walk on tennis court.', 'Get a ball.', 'Grab a racket.', 'Stand behind line.']","['Get a ball.', 'Throw ball in air.']",Throw ball in air.,1
0,0.0,[],"['walk to a tennis court', 'walk to a tennis court']",walk to a tennis court,1
1,0.2,['walk to a tennis court'],"['hit the ball back and forth', 'grab your tennis equipment']",grab your tennis equipment,1
2,0.4,"['walk to a tennis court', 'grab your tennis equipment']","['play against someone else', 'hit the ball back and forth']",play against someone else,0
3,0.6,"['walk to a tennis court', 'grab your tennis equipment', 'play against someone else']","['walk to a tennis court', 'start a game']",start a game,1
4,0.8,"['walk to a tennis court', 'grab your tennis equipment', 'play against someone else', 'start a game']","['hit the ball back and forth', 'walk to a tennis court']",hit the ball back and forth,0
0,0.0,[],"['Arrive at tennis court with racket', 'Find tennis ball']",Arrive at tennis court with racket,0
1,0.2,['Arrive at tennis court with racket'],"['Find partner', 'Arrive at tennis court with racket']",Find partner,0
2,0.4,"['Arrive at tennis court with racket', 'Find partner']","['Wait for opponent to hit back', 'Find tennis ball']",Find tennis ball,1
3,0.6,"['Arrive at tennis court with racket', 'Find partner', 'Find tennis ball']","['Use racket to serve ball', 'Arrive at tennis court with racket']",Use racket to serve ball,0
4,0.8,"['Arrive at tennis court with racket', 'Find partner', 'Find tennis ball', 'Use racket to serve ball']","['Find partner', 'Wait for opponent to hit back']",Wait for opponent to hit back,1
0,0.0,[],"['go to the tennis court', 'throw ball in air and hit with racket']",go to the tennis court,0
1,0.2,['go to the tennis court'],"['throw ball in air and hit with racket', 'wear tennis shoes']",wear tennis shoes,1
2,0.4,"['go to the tennis court', 'wear tennis shoes']","['take tennis racket and ball', 'throw ball in air and hit with racket']",take tennis racket and ball,0
3,0.6,"['go to the tennis court', 'wear tennis shoes', 'take tennis racket and ball']","['go to the tennis court', 'play with a partner']",play with a partner,1
4,0.8,"['go to the tennis court', 'wear tennis shoes', 'take tennis racket and ball', 'play with a partner']","['throw ball in air and hit with racket', 'wear tennis shoes']",throw ball in air and hit with racket,0
0,0.0,[],"['Make friend who play tennis', 'Improve your endurance']",Make friend who play tennis,0
1,0.2,['Make friend who play tennis'],"['Improve your endurance', 'Improve your endurance']",Improve your endurance,0
2,0.4,"['Make friend who play tennis', 'Improve your endurance']","['Learn the rules', 'Improve your strategy']",Improve your strategy,1
3,0.6,"['Make friend who play tennis', 'Improve your endurance', 'Improve your strategy']","['Make friend who play tennis', 'Get the right racket']",Get the right racket,1
4,0.8,"['Make friend who play tennis', 'Improve your endurance', 'Improve your strategy', 'Get the right racket']","['Learn the rules', 'Make friend who play tennis']",Learn the rules,0
0,0.0,[],"['Go to changing room', 'Enter the Stadium']",Enter the Stadium,1
1,0.2,['Enter the Stadium'],"['Go to changing room', 'Register with receptionist']",Register with receptionist,1
2,0.4,"['Enter the Stadium', 'Register with receptionist']","['Go to changing room', 'Take out racket from cover']",Go to changing room,0
3,0.6,"['Enter the Stadium', 'Register with receptionist', 'Go to changing room']","['Enter the Stadium', 'Wear tennis rig']",Wear tennis rig,1
4,0.8,"['Enter the Stadium', 'Register with receptionist', 'Go to changing room', 'Wear tennis rig']","['Enter the Stadium', 'Take out racket from cover']",Take out racket from cover,1
0,0.0,[],"['Find tennis partner/opponent', 'Find tennis partner/opponent']",Find tennis partner/opponent,0
1,0.2,['Find tennis partner/opponent'],"['Get dressed in loose clothes and tennis shoes', 'Go to court']",Get dressed in loose clothes and tennis shoes,0
2,0.4,"['Find tennis partner/opponent', 'Get dressed in loose clothes and tennis shoes']","['Play tennis', 'Get racket and balls']",Get racket and balls,1
3,0.6,"['Find tennis partner/opponent', 'Get dressed in loose clothes and tennis shoes', 'Get racket and balls']","['Go to court', 'Find tennis partner/opponent']",Go to court,0
4,0.8,"['Find tennis partner/opponent', 'Get dressed in loose clothes and tennis shoes', 'Get racket and balls', 'Go to court']","['Play tennis', 'Find tennis partner/opponent']",Play tennis,0
0,0.0,[],"['Hit ball over net to opponent.', 'Make sure you are wearing proper clothing and tennis shoes.']",Make sure you are wearing proper clothing and tennis shoes.,1
1,0.2,['Make sure you are wearing proper clothing and tennis shoes.'],"['Gather your racket and balls.', 'Go to court.']",Gather your racket and balls.,0
2,0.4,"['Make sure you are wearing proper clothing and tennis shoes.', 'Gather your racket and balls.']","['Hit ball over net to opponent.', 'Go to court.']",Go to court.,1
3,0.6,"['Make sure you are wearing proper clothing and tennis shoes.', 'Gather your racket and balls.', 'Go to court.']","['When serving, toss ball up and swing with racket.', 'Make sure you are wearing proper clothing and tennis shoes.']","When serving, toss ball up and swing with racket.",0
4,0.8,"['Make sure you are wearing proper clothing and tennis shoes.', 'Gather your racket and balls.', 'Go to court.', 'When serving, toss ball up and swing with racket.']","['Make sure you are wearing proper clothing and tennis shoes.', 'Hit ball over net to opponent.']",Hit ball over net to opponent.,1
0,0.0,[],"['Get your ball', 'Go to tennis court']",Get your ball,0
1,0.2,['Get your ball'],"['Dress in comfortable athletic clothes', 'Get your racket']",Get your racket,1
2,0.4,"['Get your ball', 'Get your racket']","['Serve your opponent the ball', 'Dress in comfortable athletic clothes']",Dress in comfortable athletic clothes,1
3,0.6,"['Get your ball', 'Get your racket', 'Dress in comfortable athletic clothes']","['Go to tennis court', 'Get your ball']",Go to tennis court,0
4,0.8,"['Get your ball', 'Get your racket', 'Dress in comfortable athletic clothes', 'Go to tennis court']","['Get your ball', 'Serve your opponent the ball']",Serve your opponent the ball,1
0,0.0,[],"['Get opponent', 'Get tennis rackets']",Get tennis rackets,1
1,0.2,['Get tennis rackets'],"['Get tennis balls', 'Get tennis balls']",Get tennis balls,0
2,0.4,"['Get tennis rackets', 'Get tennis balls']","['Player serves ball', 'Get opponent']",Get opponent,1
3,0.6,"['Get tennis rackets', 'Get tennis balls', 'Get opponent']","['Go to tennis court', 'Get tennis rackets']",Go to tennis court,0
4,0.8,"['Get tennis rackets', 'Get tennis balls', 'Get opponent', 'Go to tennis court']","['Get tennis balls', 'Player serves ball']",Player serves ball,1
0,0.0,[],"['Determine which player will serve first.', 'The ball is driven over the net to the opposite side of the center line.']",Determine which player will serve first.,0
1,0.2,['Determine which player will serve first.'],"['The serving player stands behind the back line right of the center line.', 'The serving player stands behind the back line right of the center line.']",The serving player stands behind the back line right of the center line.,0
2,0.4,"['Determine which player will serve first.', 'The serving player stands behind the back line right of the center line.']","['The ball is driven over the net to the opposite side of the center line.', 'He or she tosses the tennis ball above his head.']",He or she tosses the tennis ball above his head.,1
3,0.6,"['Determine which player will serve first.', 'The serving player stands behind the back line right of the center line.', 'He or she tosses the tennis ball above his head.']","['As the ball descends, he or she strikes the ball with a tennis racket', 'Determine which player will serve first.']","As the ball descends, he or she strikes the ball with a tennis racket",0
