task_step,task_completion_percentage,previous_actions,choices,correct_choice,correct_action
4,0.8,"['Determine which player will serve first.', 'The serving player stands behind the back line right of the center line.', 'He or she tosses the tennis ball above his head.', 'As the ball descends, he or she strikes the ball with a tennis racket']","['Determine which player will serve first.', 'The ball is driven over the net to the opposite side of the center line.']",The ball is driven over the net to the opposite side of the center line.,1
0,0.0,[],"['Unsleeve racket', 'Put on tennis outfit']",Put on tennis outfit,1
1,0.2,['Put on tennis outfit'],"['Grab tennis racket', 'Grab tennis racket']",Grab tennis racket,1
2,0.4,"['Put on tennis outfit', 'Grab tennis racket']","['Grab tennis balls', 'Unsleeve racket']",Grab tennis balls,0
3,0.6,"['Put on tennis outfit', 'Grab tennis racket', 'Grab tennis balls']","['Put on tennis outfit', 'Go to tennis court']",Go to tennis court,1
4,0.8,"['Put on tennis outfit', 'Grab tennis racket', 'Grab tennis balls', 'Go to tennis court']","['Grab tennis racket', 'Unsleeve racket']",Unsleeve racket,1
0,0.0,[],"['Find a friend to play tennis', 'Drive to tennis court']",Find a friend to play tennis,0
1,0.2,['Find a friend to play tennis'],"['Walk to tennis court', 'Gather racket and balls']",Gather racket and balls,1
2,0.4,"['Find a friend to play tennis', 'Gather racket and balls']","['Drive to tennis court', 'Play tennis with friend']",Drive to tennis court,0
3,0.6,"['Find a friend to play tennis', 'Gather racket and balls', 'Drive to tennis court']","['Find a friend to play tennis', 'Walk to tennis court']",Walk to tennis court,1
4,0.8,"['Find a friend to play tennis', 'Gather racket and balls', 'Drive to tennis court', 'Walk to tennis court']","['Play tennis with friend', 'Find a friend to play tennis']",Play tennis with friend,0
0,0.0,[],"['Put racket and balls in car', 'Put on tennis shoes']",Put on tennis shoes,1
1,0.2,['Put on tennis shoes'],"['Put racket and balls in car', 'Pick up friend']",Put racket and balls in car,0
2,0.4,"['Put on tennis shoes', 'Put racket and balls in car']","['Pick up friend', 'Take out racket and balls']",Pick up friend,0
3,0.6,"['Put on tennis shoes', 'Put racket and balls in car', 'Pick up friend']","['Drive to court', 'Put on tennis shoes']",Drive to court,0
4,0.8,"['Put on tennis shoes', 'Put racket and balls in car', 'Pick up friend', 'Drive to court']","['Put racket and balls in car', 'Take out racket and balls']",Take out racket and balls,1
0,0.0,[],"['find a partner', 'find a partner']",find a partner,0
1,0.2,['find a partner'],"['hit the ball to your partner', 'make sure you are wearing exercise clothing']",make sure you are wearing exercise clothing,1
2,0.4,"['find a partner', 'make sure you are wearing exercise clothing']","['go to a tennis court', 'hit the ball to your partner']",go to a tennis court,0
3,0.6,"['find a partner', 'make sure you are wearing exercise clothing', 'go to a tennis court']","['find a partner', 'take a racket and a ball']",take a racket and a ball,1
4,0.8,"['find a partner', 'make sure you are wearing exercise clothing', 'go to a tennis court', 'take a racket and a ball']","['find a partner', 'hit the ball to your partner']",hit the ball to your partner,1
0,0.0,[],"['get tennis clothing on', 'find a player to play with']",get tennis clothing on,0
1,0.2,['get tennis clothing on'],"['find tennis racket', 'hit ball back and forth']",find tennis racket,0
2,0.4,"['get tennis clothing on', 'find tennis racket']","['go to tennis court', 'hit ball back and forth']",go to tennis court,0
3,0.6,"['get tennis clothing on', 'find tennis racket', 'go to tennis court']","['get tennis clothing on', 'find a player to play with']",find a player to play with,1
4,0.8,"['get tennis clothing on', 'find tennis racket', 'go to tennis court', 'find a player to play with']","['hit ball back and forth', 'get tennis clothing on']",hit ball back and forth,0
0,0.0,[],"['Purchase tennis racquet', 'Reserve tennis court']",Reserve tennis court,1
1,0.2,['Reserve tennis court'],"['Purchase tennis balls', 'Dress in tennis clothing']",Dress in tennis clothing,1
2,0.4,"['Reserve tennis court', 'Dress in tennis clothing']","['Purchase tennis racquet', 'Arrive at court']",Purchase tennis racquet,0
3,0.6,"['Reserve tennis court', 'Dress in tennis clothing', 'Purchase tennis racquet']","['Purchase tennis balls', 'Reserve tennis court']",Purchase tennis balls,0
4,0.8,"['Reserve tennis court', 'Dress in tennis clothing', 'Purchase tennis racquet', 'Purchase tennis balls']","['Dress in tennis clothing', 'Arrive at court']",Arrive at court,1
0,0.0,[],"['Get tennis balls and racket', 'Find another person to play with']",Get tennis balls and racket,0
1,0.2,['Get tennis balls and racket'],"['Find another person to play with', 'Find another person to play with']",Find another person to play with,0
2,0.4,"['Get tennis balls and racket', 'Find another person to play with']","['Keep score of who misses', 'Go to a tennis court']",Go to a tennis court,1
3,0.6,"['Get tennis balls and racket', 'Find another person to play with', 'Go to a tennis court']","['Get tennis balls and racket', 'Hit ball back and Forth']",Hit ball back and Forth,1
4,0.8,"['Get tennis balls and racket', 'Find another person to play with', 'Go to a tennis court', 'Hit ball back and Forth']","['Keep score of who misses', 'Find another person to play with']",Keep score of who misses,0
0,0.0,[],"['Play game', 'Get tennis racket and ball']",Get tennis racket and ball,1
1,0.2,['Get tennis racket and ball'],"['Go to tennis court', 'Get tennis racket and ball']",Go to tennis court,0
2,0.4,"['Get tennis racket and ball', 'Go to tennis court']","['Get players on either side of net', 'Play game']",Get players on either side of net,0
3,0.6,"['Get tennis racket and ball', 'Go to tennis court', 'Get players on either side of net']","['Get tennis racket and ball', 'Serve ball']",Serve ball,1
4,0.8,"['Get tennis racket and ball', 'Go to tennis court', 'Get players on either side of net', 'Serve ball']","['Play game', 'Go to tennis court']",Play game,0
0,0.0,[],"['Serve the ball', 'Put on appropriate clothing']",Put on appropriate clothing,1
1,0.2,['Put on appropriate clothing'],"['Find a tennis partner', 'Take tennis rackets and tennis balls']",Find a tennis partner,0
2,0.4,"['Put on appropriate clothing', 'Find a tennis partner']","['Serve the ball', 'Take tennis rackets and tennis balls']",Take tennis rackets and tennis balls,1
3,0.6,"['Put on appropriate clothing', 'Find a tennis partner', 'Take tennis rackets and tennis balls']","['Stand on opposite sides of the court', 'Put on appropriate clothing']",Stand on opposite sides of the court,0
4,0.8,"['Put on appropriate clothing', 'Find a tennis partner', 'Take tennis rackets and tennis balls', 'Stand on opposite sides of the court']","['Serve the ball', 'Find a tennis partner']",Serve the ball,0
0,0.0,[],"['dress for tennis', 'gather your gear']",dress for tennis,0
1,0.2,['dress for tennis'],"['gather your gear', 'gather your gear']",gather your gear,1
2,0.4,"['dress for tennis', 'gather your gear']","['pick your court', 'make sure you have balls']",make sure you have balls,1
3,0.6,"['dress for tennis', 'gather your gear', 'make sure you have balls']","['get to the court', 'dress for tennis']",get to the court,0
4,0.8,"['dress for tennis', 'gather your gear', 'make sure you have balls', 'get to the court']","['gather your gear', 'pick your court']",pick your court,1
0,0.0,[],"['Find a partner', 'Find a partner']",Find a partner,1
1,0.2,['Find a partner'],"['Change into appropriate clothes', 'Change into appropriate clothes']",Change into appropriate clothes,0
2,0.4,"['Find a partner', 'Change into appropriate clothes']","['Begin game.', 'Stretch out']",Stretch out,1
3,0.6,"['Find a partner', 'Change into appropriate clothes', 'Stretch out']","['Volley for serve', 'Find a partner']",Volley for serve,0
4,0.8,"['Find a partner', 'Change into appropriate clothes', 'Stretch out', 'Volley for serve']","['Change into appropriate clothes', 'Begin game.']",Begin game.,1
0,0.0,[],"['Get your gear together, racket and balls', 'Get your gear together, racket and balls']","Get your gear together, racket and balls",1
1,0.2,"['Get your gear together, racket and balls']","['Have a partner lined up.', 'Play tennis by hitting the ball back and forth']",Have a partner lined up.,0
2,0.4,"['Get your gear together, racket and balls', 'Have a partner lined up.']","['Play tennis by hitting the ball back and forth', 'Put on your tennis clothes']",Put on your tennis clothes,1
3,0.6,"['Get your gear together, racket and balls', 'Have a partner lined up.', 'Put on your tennis clothes']","['Get your gear together, racket and balls', 'Travel to the tennis court']",Travel to the tennis court,1
4,0.8,"['Get your gear together, racket and balls', 'Have a partner lined up.', 'Put on your tennis clothes', 'Travel to the tennis court']","['Have a partner lined up.', 'Play tennis by hitting the ball back and forth']",Play tennis by hitting the ball back and forth,1
0,0.0,[],"['Wear short dress', 'Wear short dress']",Wear short dress,0
1,0.2,['Wear short dress'],"['Take tennis bat and ball', 'Take tennis bat and ball']",Take tennis bat and ball,0
2,0.4,"['Wear short dress', 'Take tennis bat and ball']","['Running play', 'Against one player']",Against one player,1
3,0.6,"['Wear short dress', 'Take tennis bat and ball', 'Against one player']","['Wear short dress', 'Rectangle ground want']",Rectangle ground want,1
4,0.8,"['Wear short dress', 'Take tennis bat and ball', 'Against one player', 'Rectangle ground want']","['Running play', 'Wear short dress']",Running play,0
0,0.0,[],"['Get dressed in tennis clothes.', 'Go to tennis court.']",Get dressed in tennis clothes.,0
1,0.2,['Get dressed in tennis clothes.'],"['Go to tennis court.', 'Get tennis equipment.']",Get tennis equipment.,1
2,0.4,"['Get dressed in tennis clothes.', 'Get tennis equipment.']","['Take out tennis balls.', 'Go to tennis court.']",Go to tennis court.,1
3,0.6,"['Get dressed in tennis clothes.', 'Get tennis equipment.', 'Go to tennis court.']","['Get dressed in tennis clothes.', 'Take out racket.']",Take out racket.,1
4,0.8,"['Get dressed in tennis clothes.', 'Get tennis equipment.', 'Go to tennis court.', 'Take out racket.']","['Get tennis equipment.', 'Take out tennis balls.']",Take out tennis balls.,1
0,0.0,[],"['Arrange for opponent', 'Change into comfortable clothing/ shoes']",Change into comfortable clothing/ shoes,1
1,0.2,['Change into comfortable clothing/ shoes'],"['Arrange for opponent', 'Get tennis racket and balls']",Get tennis racket and balls,1
2,0.4,"['Change into comfortable clothing/ shoes', 'Get tennis racket and balls']","['Determine which side each player will take', 'Arrange for opponent']",Arrange for opponent,1
3,0.6,"['Change into comfortable clothing/ shoes', 'Get tennis racket and balls', 'Arrange for opponent']","['Change into comfortable clothing/ shoes', 'Go to tennis court']",Go to tennis court,1
4,0.8,"['Change into comfortable clothing/ shoes', 'Get tennis racket and balls', 'Arrange for opponent', 'Go to tennis court']","['Change into comfortable clothing/ shoes', 'Determine which side each player will take']",Determine which side each player will take,1
0,0.0,[],"['Make a date with a friend to play tennis', 'Get dressed in a tennis outfit']",Make a date with a friend to play tennis,0
1,0.2,['Make a date with a friend to play tennis'],"['Get dressed in a tennis outfit', 'Get racket and balls']",Get dressed in a tennis outfit,0
2,0.4,"['Make a date with a friend to play tennis', 'Get dressed in a tennis outfit']","['Put on tennis shoes', 'Get into car']",Put on tennis shoes,0
3,0.6,"['Make a date with a friend to play tennis', 'Get dressed in a tennis outfit', 'Put on tennis shoes']","['Make a date with a friend to play tennis', 'Get racket and balls']",Get racket and balls,1
4,0.8,"['Make a date with a friend to play tennis', 'Get dressed in a tennis outfit', 'Put on tennis shoes', 'Get racket and balls']","['Get into car', 'Make a date with a friend to play tennis']",Get into car,0
0,0.0,[],"['Get a tennis racket', 'Find someone to play tennis with']",Find someone to play tennis with,1
1,0.2,['Find someone to play tennis with'],"['Dress appropriately', 'Get tennis balls']",Dress appropriately,0
2,0.4,"['Find someone to play tennis with', 'Dress appropriately']","['Go to a tennis court', 'Get a tennis racket']",Get a tennis racket,1
3,0.6,"['Find someone to play tennis with', 'Dress appropriately', 'Get a tennis racket']","['Find someone to play tennis with', 'Get tennis balls']",Get tennis balls,1
4,0.8,"['Find someone to play tennis with', 'Dress appropriately', 'Get a tennis racket', 'Get tennis balls']","['Find someone to play tennis with', 'Go to a tennis court']",Go to a tennis court,1
0,0.0,[],"['Get a playing partner (or 3 if you want to play doubles)', 'Get out your tennis racket and tennis balls']",Get a playing partner (or 3 if you want to play doubles),0
1,0.2,['Get a playing partner (or 3 if you want to play doubles)'],"['Get a playing partner (or 3 if you want to play doubles)', 'Get out your tennis racket and tennis balls']",Get out your tennis racket and tennis balls,1
2,0.4,"['Get a playing partner (or 3 if you want to play doubles)', 'Get out your tennis racket and tennis balls']","['Wear appropriate tennis shoes for the tennis court.', 'If there is no free court, sign up for the next available one.']",Wear appropriate tennis shoes for the tennis court.,0
3,0.6,"['Get a playing partner (or 3 if you want to play doubles)', 'Get out your tennis racket and tennis balls', 'Wear appropriate tennis shoes for the tennis court.']","['Go to tennis court.', 'Get a playing partner (or 3 if you want to play doubles)']",Go to tennis court.,0
4,0.8,"['Get a playing partner (or 3 if you want to play doubles)', 'Get out your tennis racket and tennis balls', 'Wear appropriate tennis shoes for the tennis court.', 'Go to tennis court.']","['Get out your tennis racket and tennis balls', 'If there is no free court, sign up for the next available one.']","If there is no free court, sign up for the next available one.",1
0,0.0,[],"['Stand with racquets on opposite sides of net', 'Find an opponent to play against']",Find an opponent to play against,1
1,0.2,['Find an opponent to play against'],"['Get a racquet for each of you', 'Find an available tennis court']",Get a racquet for each of you,0
2,0.4,"['Find an opponent to play against', 'Get a racquet for each of you']","['Stand with racquets on opposite sides of net', 'Open a new can of balls, or test old balls to find three that bounce well']","Open a new can of balls, or test old balls to find three that bounce well",1
3,0.6,"['Find an opponent to play against', 'Get a racquet for each of you', 'Open a new can of balls, or test old balls to find three that bounce well']","['Find an available tennis court', 'Find an opponent to play against']",Find an available tennis court,0
4,0.8,"['Find an opponent to play against', 'Get a racquet for each of you', 'Open a new can of balls, or test old balls to find three that bounce well', 'Find an available tennis court']","['Find an opponent to play against', 'Stand with racquets on opposite sides of net']",Stand with racquets on opposite sides of net,1
0,0.0,[],"['Change into tennis outfit', 'Change into tennis outfit']",Change into tennis outfit,0
1,0.2,['Change into tennis outfit'],"['Arrive at tennis court', 'Gather equipment such as tennis racquet and balls']",Gather equipment such as tennis racquet and balls,1
2,0.4,"['Change into tennis outfit', 'Gather equipment such as tennis racquet and balls']","['have a great game', 'Arrive at tennis court']",Arrive at tennis court,1
3,0.6,"['Change into tennis outfit', 'Gather equipment such as tennis racquet and balls', 'Arrive at tennis court']","['Change into tennis outfit', 'Meet playing partner']",Meet playing partner,1
4,0.8,"['Change into tennis outfit', 'Gather equipment such as tennis racquet and balls', 'Arrive at tennis court', 'Meet playing partner']","['Change into tennis outfit', 'have a great game']",have a great game,1
0,0.0,[],"['Wear loose, comfortable clothes', 'Get a tennis racket and balls']","Wear loose, comfortable clothes",0
1,0.2,"['Wear loose, comfortable clothes']","['Get a tennis racket and balls', 'Get a partner']",Get a tennis racket and balls,0
2,0.4,"['Wear loose, comfortable clothes', 'Get a tennis racket and balls']","['Get a partner', ""Serve the ball into the small square opposite the side you're on""]",Get a partner,0
3,0.6,"['Wear loose, comfortable clothes', 'Get a tennis racket and balls', 'Get a partner']","['Go to tennis court', 'Wear loose, comfortable clothes']",Go to tennis court,0
4,0.8,"['Wear loose, comfortable clothes', 'Get a tennis racket and balls', 'Get a partner', 'Go to tennis court']","[""Serve the ball into the small square opposite the side you're on"", 'Wear loose, comfortable clothes']",Serve the ball into the small square opposite the side you're on,0
0,0.0,[],"['Wait for your opponent to hit the ball back', 'Get tennis shoes']",Get tennis shoes,1
1,0.2,['Get tennis shoes'],"['Serve the ball', 'Get ready to hit the ball']",Serve the ball,0
2,0.4,"['Get tennis shoes', 'Serve the ball']","['Swing the racquet', 'Wait for your opponent to hit the ball back']",Wait for your opponent to hit the ball back,1
3,0.6,"['Get tennis shoes', 'Serve the ball', 'Wait for your opponent to hit the ball back']","['Get ready to hit the ball', 'Get tennis shoes']",Get ready to hit the ball,0
4,0.8,"['Get tennis shoes', 'Serve the ball', 'Wait for your opponent to hit the ball back', 'Get ready to hit the ball']","['Swing the racquet', 'Get tennis shoes']",Swing the racquet,0
0,0.0,[],"['Gather equipment.', 'Get dressed in athletic gear.']",Get dressed in athletic gear.,1
1,0.2,['Get dressed in athletic gear.'],"['Go to the park.', 'Gather equipment.']",Gather equipment.,1
2,0.4,"['Get dressed in athletic gear.', 'Gather equipment.']","['Grab racket and balls from the bag.', 'Get a friend to play with. If no friend, get a ball machine.']","Get a friend to play with. If no friend, get a ball machine.",1
3,0.6,"['Get dressed in athletic gear.', 'Gather equipment.', 'Get a friend to play with. If no friend, get a ball machine.']","['Go to the park.', 'Get dressed in athletic gear.']",Go to the park.,0
4,0.8,"['Get dressed in athletic gear.', 'Gather equipment.', 'Get a friend to play with. If no friend, get a ball machine.', 'Go to the park.']","['Get dressed in athletic gear.', 'Grab racket and balls from the bag.']",Grab racket and balls from the bag.,1
0,0.0,[],"['go to a park to a tennis court with friend', 'call friends to see who is available to play tennis']",call friends to see who is available to play tennis,1
1,0.2,['call friends to see who is available to play tennis'],"['get dressed with tennis gear and bring water', 'get dressed with tennis gear and bring water']",get dressed with tennis gear and bring water,0
2,0.4,"['call friends to see who is available to play tennis', 'get dressed with tennis gear and bring water']","['go to a park to a tennis court with friend', 'play tennis with a friend']",go to a park to a tennis court with friend,0
3,0.6,"['call friends to see who is available to play tennis', 'get dressed with tennis gear and bring water', 'go to a park to a tennis court with friend']","['set up the net', 'call friends to see who is available to play tennis']",set up the net,0
4,0.8,"['call friends to see who is available to play tennis', 'get dressed with tennis gear and bring water', 'go to a park to a tennis court with friend', 'set up the net']","['call friends to see who is available to play tennis', 'play tennis with a friend']",play tennis with a friend,1
0,0.0,[],"['Find a location with a tennis court', 'Get in car']",Find a location with a tennis court,0
1,0.2,['Find a location with a tennis court'],"['Prepare materials to play tennis', 'Find a location with a tennis court']",Prepare materials to play tennis,0
2,0.4,"['Find a location with a tennis court', 'Prepare materials to play tennis']","['Get in car', 'Exit the car']",Get in car,0
3,0.6,"['Find a location with a tennis court', 'Prepare materials to play tennis', 'Get in car']","['Find a location with a tennis court', 'Drive to tennis court']",Drive to tennis court,1
4,0.8,"['Find a location with a tennis court', 'Prepare materials to play tennis', 'Get in car', 'Drive to tennis court']","['Find a location with a tennis court', 'Exit the car']",Exit the car,1
0,0.0,[],"['get tennis clothes', 'get tennis equipment']",get tennis clothes,0
1,0.2,['get tennis clothes'],"['get tennis shoes', 'put tennis clothes on']",get tennis shoes,0
2,0.4,"['get tennis clothes', 'get tennis shoes']","['get tennis equipment', 'put tennis clothes on']",get tennis equipment,0
3,0.6,"['get tennis clothes', 'get tennis shoes', 'get tennis equipment']","['get tennis clothes', 'reserve a tennis court']",reserve a tennis court,1
4,0.8,"['get tennis clothes', 'get tennis shoes', 'get tennis equipment', 'reserve a tennis court']","['get tennis shoes', 'put tennis clothes on']",put tennis clothes on,1
0,0.0,[],"['Get good shoes and take rackets to the nearest tennis court.', 'Practice and warm-up by self-serving and hitting balls yourself.']",Get good shoes and take rackets to the nearest tennis court.,0
1,0.2,['Get good shoes and take rackets to the nearest tennis court.'],"['Practice and warm-up by self-serving and hitting balls yourself.', 'Find or play against a prepared opponent, either for fun or score.']",Practice and warm-up by self-serving and hitting balls yourself.,0
2,0.4,"['Get good shoes and take rackets to the nearest tennis court.', 'Practice and warm-up by self-serving and hitting balls yourself.']","['Find or play against a prepared opponent, either for fun or score.', ""Have fun and win if applicable, but remember that it's just a game.""]","Find or play against a prepared opponent, either for fun or score.",0
3,0.6,"['Get good shoes and take rackets to the nearest tennis court.', 'Practice and warm-up by self-serving and hitting balls yourself.', 'Find or play against a prepared opponent, either for fun or score.']","['Serve the ball, and try to keep a volley and knock your opponent out.', 'Get good shoes and take rackets to the nearest tennis court.']","Serve the ball, and try to keep a volley and knock your opponent out.",0
4,0.8,"['Get good shoes and take rackets to the nearest tennis court.', 'Practice and warm-up by self-serving and hitting balls yourself.', 'Find or play against a prepared opponent, either for fun or score.', 'Serve the ball, and try to keep a volley and knock your opponent out.']","['Practice and warm-up by self-serving and hitting balls yourself.', ""Have fun and win if applicable, but remember that it's just a game.""]","Have fun and win if applicable, but remember that it's just a game.",1
0,0.0,[],"['Pack tennis bag with racquet, towels, and tennis balls.', 'Warm up.']","Pack tennis bag with racquet, towels, and tennis balls.",0
1,0.2,"['Pack tennis bag with racquet, towels, and tennis balls.']","['Make sure your racquet is properly strung.', 'Wear proper shoes and socks.']",Wear proper shoes and socks.,1
2,0.4,"['Pack tennis bag with racquet, towels, and tennis balls.', 'Wear proper shoes and socks.']","['Warm up.', 'Bring water and/or fluids.']",Bring water and/or fluids.,1
3,0.6,"['Pack tennis bag with racquet, towels, and tennis balls.', 'Wear proper shoes and socks.', 'Bring water and/or fluids.']","['Make sure your racquet is properly strung.', 'Pack tennis bag with racquet, towels, and tennis balls.']",Make sure your racquet is properly strung.,0
4,0.8,"['Pack tennis bag with racquet, towels, and tennis balls.', 'Wear proper shoes and socks.', 'Bring water and/or fluids.', 'Make sure your racquet is properly strung.']","['Wear proper shoes and socks.', 'Warm up.']",Warm up.,1
0,0.0,[],"['Buy a tennis racket and tennis balls', 'Invite someone to join you for tennis']",Buy a tennis racket and tennis balls,0
1,0.2,['Buy a tennis racket and tennis balls'],"['Find/go to a tennis court with your friend', 'Invite someone to join you for tennis']",Invite someone to join you for tennis,1
2,0.4,"['Buy a tennis racket and tennis balls', 'Invite someone to join you for tennis']","['Get dressed in athletic clothing and tennis shoes', 'Serve the ball']",Get dressed in athletic clothing and tennis shoes,0
3,0.6,"['Buy a tennis racket and tennis balls', 'Invite someone to join you for tennis', 'Get dressed in athletic clothing and tennis shoes']","['Buy a tennis racket and tennis balls', 'Find/go to a tennis court with your friend']",Find/go to a tennis court with your friend,1
4,0.8,"['Buy a tennis racket and tennis balls', 'Invite someone to join you for tennis', 'Get dressed in athletic clothing and tennis shoes', 'Find/go to a tennis court with your friend']","['Serve the ball', 'Invite someone to join you for tennis']",Serve the ball,0
0,0.0,[],"['find tennis partner', 'schedule a time to play tennis']",find tennis partner,0
1,0.2,['find tennis partner'],"['drive to tennis court', 'schedule a time to play tennis']",schedule a time to play tennis,1
2,0.4,"['find tennis partner', 'schedule a time to play tennis']","['grab tennis racket and ball', 'drive to tennis court']",grab tennis racket and ball,0
3,0.6,"['find tennis partner', 'schedule a time to play tennis', 'grab tennis racket and ball']","['find tennis court', 'find tennis partner']",find tennis court,0
4,0.8,"['find tennis partner', 'schedule a time to play tennis', 'grab tennis racket and ball', 'find tennis court']","['find tennis partner', 'drive to tennis court']",drive to tennis court,1
