task_step,task_completion_percentage,previous_actions,choices,correct_choice,correct_action
0,0.0,[],"['Get tennis racket', 'Ask person to play tennis']",Get tennis racket,0
1,0.2,['Get tennis racket'],"['Walk onto tennis court', 'Get tennis balls']",Get tennis balls,1
2,0.4,"['Get tennis racket', 'Get tennis balls']","['Ask person to play tennis', 'Hold a tennis ball']",Ask person to play tennis,0
3,0.6,"['Get tennis racket', 'Get tennis balls', 'Ask person to play tennis']","['Walk onto tennis court', 'Get tennis racket']",Walk onto tennis court,0
4,0.8,"['Get tennis racket', 'Get tennis balls', 'Ask person to play tennis', 'Walk onto tennis court']","['Hold a tennis ball', 'Get tennis racket']",Hold a tennis ball,0
0,0.0,[],"['Bounce the ball three times on the ground.', 'Serve it overhand from the back right corner.']",Bounce the ball three times on the ground.,0
1,0.2,['Bounce the ball three times on the ground.'],"['Serve it overhand from the back right corner.', 'Bounce the ball three times on the ground.']",Serve it overhand from the back right corner.,0
2,0.4,"['Bounce the ball three times on the ground.', 'Serve it overhand from the back right corner.']","['Shake hands to show sportsmanship.', 'Get rebounds from the other player and hit them back.']",Get rebounds from the other player and hit them back.,1
3,0.6,"['Bounce the ball three times on the ground.', 'Serve it overhand from the back right corner.', 'Get rebounds from the other player and hit them back.']","['Bounce the ball three times on the ground.', 'Repeat until one person has won.']",Repeat until one person has won.,1
4,0.8,"['Bounce the ball three times on the ground.', 'Serve it overhand from the back right corner.', 'Get rebounds from the other player and hit them back.', 'Repeat until one person has won.']","['Serve it overhand from the back right corner.', 'Shake hands to show sportsmanship.']",Shake hands to show sportsmanship.,1
0,0.0,[],"['Dress in a tennis outfit.', 'Obtain a racquet and ball.']",Dress in a tennis outfit.,0
1,0.2,['Dress in a tennis outfit.'],"['Drive to the tennis court.', 'Drive to the tennis court.']",Drive to the tennis court.,0
2,0.4,"['Dress in a tennis outfit.', 'Drive to the tennis court.']","['Obtain a racquet and ball.', 'Rally the ball back and forth against your opponent.']",Obtain a racquet and ball.,0
3,0.6,"['Dress in a tennis outfit.', 'Drive to the tennis court.', 'Obtain a racquet and ball.']","['Dress in a tennis outfit.', 'Serve the ball.']",Serve the ball.,1
4,0.8,"['Dress in a tennis outfit.', 'Drive to the tennis court.', 'Obtain a racquet and ball.', 'Serve the ball.']","['Dress in a tennis outfit.', 'Rally the ball back and forth against your opponent.']",Rally the ball back and forth against your opponent.,1
0,0.0,[],"['Find playing partner', 'Charge into tennis attire']",Charge into tennis attire,1
1,0.2,['Charge into tennis attire'],"['Wait for partner to hit ball', 'Find playing partner']",Find playing partner,1
2,0.4,"['Charge into tennis attire', 'Find playing partner']","['Serve ball to partner', 'Try and hit ball when it returns to my side']",Serve ball to partner,0
3,0.6,"['Charge into tennis attire', 'Find playing partner', 'Serve ball to partner']","['Charge into tennis attire', 'Wait for partner to hit ball']",Wait for partner to hit ball,1
4,0.8,"['Charge into tennis attire', 'Find playing partner', 'Serve ball to partner', 'Wait for partner to hit ball']","['Find playing partner', 'Try and hit ball when it returns to my side']",Try and hit ball when it returns to my side,1
0,0.0,[],"['Take out your racket.', 'Dress up in athletic clothing.']",Dress up in athletic clothing.,1
1,0.2,['Dress up in athletic clothing.'],"['Meet a friend at the tennis court.', 'Get tennis balls.']",Get tennis balls.,1
2,0.4,"['Dress up in athletic clothing.', 'Get tennis balls.']","['Meet a friend at the tennis court.', 'Take out your racket.']",Meet a friend at the tennis court.,0
3,0.6,"['Dress up in athletic clothing.', 'Get tennis balls.', 'Meet a friend at the tennis court.']","['Stretch.', 'Dress up in athletic clothing.']",Stretch.,0
4,0.8,"['Dress up in athletic clothing.', 'Get tennis balls.', 'Meet a friend at the tennis court.', 'Stretch.']","['Take out your racket.', 'Dress up in athletic clothing.']",Take out your racket.,0
0,0.0,[],"['Call a friend or find someone to play with.', 'Wear comfortable clothing and tennis shoes.']",Call a friend or find someone to play with.,0
1,0.2,['Call a friend or find someone to play with.'],"['Get your racket and tennis balls.', 'Get dressed to go play. ']",Get dressed to go play. ,1
2,0.4,"['Call a friend or find someone to play with.', 'Get dressed to go play. ']","[""Bring more than one tennis ball so you don't have to chase them every time."", 'Wear comfortable clothing and tennis shoes.']",Wear comfortable clothing and tennis shoes.,1
3,0.6,"['Call a friend or find someone to play with.', 'Get dressed to go play. ', 'Wear comfortable clothing and tennis shoes.']","['Call a friend or find someone to play with.', 'Get your racket and tennis balls.']",Get your racket and tennis balls.,1
4,0.8,"['Call a friend or find someone to play with.', 'Get dressed to go play. ', 'Wear comfortable clothing and tennis shoes.', 'Get your racket and tennis balls.']","[""Bring more than one tennis ball so you don't have to chase them every time."", 'Call a friend or find someone to play with.']",Bring more than one tennis ball so you don't have to chase them every time.,0
